{
  "$schema": "../manifest.schema.json",
  "schemaVersion": 1,
  "id": "super-panoramic",
  "code": "OP-01",
  "status": "pending",
  "units": "metres",
  "upAxis": "Y",
  "origin": "court-centre",
  "dimensions": { "length": 20, "width": 10 },
  "transform": { "position": [0, 0, 0], "rotation": [0, 0, 0], "scale": [1, 1, 1] },
  "components": {
    "frame": { "src": "frame.glb", "materialRole": "structure" },
    "glass": { "src": "glass.glb", "materialRole": "glass" },
    "fence": { "src": "fence.glb", "materialRole": "structure" },
    "net": { "src": "net.glb", "materialRole": "net" },
    "poles": { "src": "poles.glb", "materialRole": "structure", "optional": true },
    "protection": { "src": "protection.glb", "materialRole": "protection", "optional": true },
    "mobileBase": { "src": "mobile-base.glb", "materialRole": "structure", "optional": true }
  },
  "mounts": {
    "lighting": [
      { "position": [-5.28, 5.8, -6.4], "rotation": [0, 0, 0] },
      { "position": [5.28, 5.8, -6.4], "rotation": [0, 0, 0] },
      { "position": [-5.28, 5.8, 6.4], "rotation": [0, 0, 0] },
      { "position": [5.28, 5.8, 6.4], "rotation": [0, 0, 0] }
    ]
  },
  "camera": { "target": [0, 1.5, 0], "defaultPosition": [15, 12, 18] },
  "validation": {
    "manufacturerDrawingRevision": null,
    "geometryVerified": false,
    "verifiedAt": null
  }
}

